Member Number, UTORID, Student Name, Githubid, Status, Role
1, fuyuhan6, Yuhan Fu, Yuhan-Ut, enrolled, Full-stack developer/ Documentarian
2, hejingy4, Jingyu He, JacqJingyuH, enrolled, Full-stack Developer/ Product Manager
3, lyuxiny2, Xinyan Lyu, Maxlyu254, enrolled, Communicate/front-end developer
4, wang2431, Zihan Wang, MacroSony, enrolled, UI/UX designer/full-stack developer
5, yinhao2, Hao Yin, yin0409, enrolled, Project manager/ database developer
6, zha10066, Yifang Zhang, yi1z, enrolled, Project manager/full-stack developer(mainly database)
